File Author,Build Location,Budget Limit,Project ID,Date of Approval,Est. Date of Completion,Version Author,Version Date,CommitID,CommitMsg,Last Current Version
Blueprint Creator,"(51N,-114W)",120000,12345678,09/29/2025,03/25/2026,Alice,10/04/2025,001,Added new doorway into bathroom.,0
,,,,,,Bob,10/05/2025,002,Door added from bedroom to bathroom.,1
,,,,,,Claire,10/06/2025,003,Added sliding door to bedroom.,1
,,,,,,Dylan,10/06/2025,004,Added door to bathroom.,2
,,,,,,Edward,10/07/2025,005,Added door from bedroom to kitchen.,2
,,,,,,Fred,10/10/2025,006,Removed sliding door to bedroom.,2
,,,,,,George,10/11/2025,007,Changed door from bedroom to kitchen to a sliding door.,3
,,,,,,Hannah,10/11/2025,008,Changed door from bedroom to bathroom to a sliding door.,3